Activity,Time (min),Setup,Instructions,Coaching Cues,Variations
Split-step & react,1,Service line,Coach points left/right; player reacts with shuffle,React fast then recover,Add fake calls for challenge
Forward-back shuffles,1,Baseline ↔ service line,Move forward/back maintaining split step,Stay on toes,Teens full speed
Diagonal runs,1,Baseline corner to service line,Run diagonally to opposite side then recover,Explosive start,Reduce court for small kids
Cone zig-zag,1,Cones every 2m,Move through cones with low center,Quick feet,Add ball carry for coordination
Hop-split recover,1,Service line,Shadow stroke → hop → split → reset,Quiet landings,Add racket swing for timing
