Activity,Time (min),Setup,Instructions,Coaching Cues,Variations
Arm swings,0.5,Stationary,Large circles forward/backward,Loose shoulders,Add resistance band for teens
Walking lunges + twist,1.5,Service boxes,Step and twist torso with racket overhead,Keep balance,Shorter stride for younger
Knee hugs / heel pulls,1,Baseline to service line,Hug knee to chest then pull heel to glutes,Stay tall posture,Hold for 2 sec each
Side lunges,1,Across court,Step wide and shift weight side to side,Knee tracks over toes,Add racket for balance
Shadow swings,1,Half court,Slow forehand/backhand focusing on flow,Follow through fully,Add split step between swings
